ProductId,AccountId,Like,Comments
30,8,81,Nulla justo. Aliquam quis turpis eget elit sodales scelerisque.
15,10,94,Vivamus tortor.
5,9,32,"Aliquam augue quam, sollicitudin vitae, consectetuer eget, rutrum at, lorem. Integer tincidunt ante vel ipsum. Praesent blandit lacinia erat."
1,6,82,In hac habitasse platea dictumst. Etiam faucibus cursus urna. Ut tellus. Nulla ut erat id mauris vulputate elementum.
37,5,74,"Nam nulla. Integer pede justo, lacinia eget, tincidunt eget, tempus vel, pede. Morbi porttitor lorem id ligula. Suspendisse ornare consequat lectus. In est risus, auctor sed, tristique in, tempus sit amet, sem. Fusce consequat. Nulla nisl. Nunc nisl."
55,10,3,Aenean auctor gravida sem. Praesent id massa id nisl venenatis lacinia.
35,7,75,Aliquam quis turpis eget elit sodales scelerisque. Mauris sit amet eros. Suspendisse accumsan tortor quis turpis. Sed ante. Vivamus tortor.
38,7,19,Integer non velit.
35,4,98,"Integer aliquet, massa id lobortis convallis, tortor risus dapibus augue, vel accumsan tellus nisi eu orci. Mauris lacinia sapien quis libero. Nullam sit amet turpis elementum ligula vehicula consequat. Morbi a ipsum. Integer a nibh. In quis justo."
23,10,9,"Maecenas pulvinar lobortis est. Phasellus sit amet erat. Nulla tempus. Vivamus in felis eu sapien cursus vestibulum. Proin eu mi. Nulla ac enim. In tempor, turpis nec euismod scelerisque, quam turpis adipiscing lorem, vitae mattis nibh ligula nec sem. Duis aliquam convallis nunc. Proin at turpis a pede posuere nonummy. Integer non velit."
48,3,34,"Vestibulum rutrum rutrum neque. Aenean auctor gravida sem. Praesent id massa id nisl venenatis lacinia. Aenean sit amet justo. Morbi ut odio. Cras mi pede, malesuada in, imperdiet et, commodo vulputate, justo."
24,9,38,"Vestibulum sed magna at nunc commodo placerat. Praesent blandit. Nam nulla. Integer pede justo, lacinia eget, tincidunt eget, tempus vel, pede. Morbi porttitor lorem id ligula. Suspendisse ornare consequat lectus. In est risus, auctor sed, tristique in, tempus sit amet, sem. Fusce consequat. Nulla nisl."
51,9,56,Vestibulum ante ipsum primis in faucibus orci luctus et ultrices posuere cubilia Curae; Mauris viverra diam vitae quam. Suspendisse potenti. Nullam porttitor lacus at turpis. Donec posuere metus vitae ipsum. Aliquam non mauris. Morbi non lectus. Aliquam sit amet diam in magna bibendum imperdiet.
12,7,12,"Suspendisse accumsan tortor quis turpis. Sed ante. Vivamus tortor. Duis mattis egestas metus. Aenean fermentum. Donec ut mauris eget massa tempor convallis. Nulla neque libero, convallis eget, eleifend luctus, ultricies eu, nibh."
51,6,11,Praesent blandit lacinia erat. Vestibulum sed magna at nunc commodo placerat. Praesent blandit.
35,8,45,"Vestibulum ante ipsum primis in faucibus orci luctus et ultrices posuere cubilia Curae; Nulla dapibus dolor vel est. Donec odio justo, sollicitudin ut, suscipit a, feugiat et, eros. Vestibulum ac est lacinia nisi venenatis tristique. Fusce congue, diam id ornare imperdiet, sapien urna pretium nisl, ut volutpat sapien arcu sed augue. Aliquam erat volutpat. In congue. Etiam justo. Etiam pretium iaculis justo."
38,5,64,"In hac habitasse platea dictumst. Morbi vestibulum, velit id pretium iaculis, diam erat fermentum justo, nec condimentum neque sapien placerat ante. Nulla justo. Aliquam quis turpis eget elit sodales scelerisque. Mauris sit amet eros. Suspendisse accumsan tortor quis turpis. Sed ante. Vivamus tortor. Duis mattis egestas metus. Aenean fermentum."
27,3,34,"Nunc rhoncus dui vel sem. Sed sagittis. Nam congue, risus semper porta volutpat, quam pede lobortis ligula, sit amet eleifend pede libero quis orci. Nullam molestie nibh in lectus. Pellentesque at nulla. Suspendisse potenti."
1,7,70,Duis bibendum. Morbi non quam nec dui luctus rutrum. Nulla tellus. In sagittis dui vel nisl. Duis ac nibh.
51,8,70,"In tempor, turpis nec euismod scelerisque, quam turpis adipiscing lorem, vitae mattis nibh ligula nec sem. Duis aliquam convallis nunc. Proin at turpis a pede posuere nonummy. Integer non velit. Donec diam neque, vestibulum eget, vulputate ut, ultrices vel, augue. Vestibulum ante ipsum primis in faucibus orci luctus et ultrices posuere cubilia Curae; Donec pharetra, magna vestibulum aliquet ultrices, erat tortor sollicitudin mi, sit amet lobortis sapien sapien non mi. Integer ac neque. Duis bibendum. Morbi non quam nec dui luctus rutrum. Nulla tellus."
4,4,70,Nulla justo. Aliquam quis turpis eget elit sodales scelerisque. Mauris sit amet eros. Suspendisse accumsan tortor quis turpis. Sed ante. Vivamus tortor. Duis mattis egestas metus.
12,4,81,Proin eu mi. Nulla ac enim.
31,6,41,"Donec diam neque, vestibulum eget, vulputate ut, ultrices vel, augue. Vestibulum ante ipsum primis in faucibus orci luctus et ultrices posuere cubilia Curae; Donec pharetra, magna vestibulum aliquet ultrices, erat tortor sollicitudin mi, sit amet lobortis sapien sapien non mi. Integer ac neque."
27,3,65,Morbi a ipsum. Integer a nibh. In quis justo. Maecenas rhoncus aliquam lacus.
23,4,4,Aenean lectus. Pellentesque eget nunc. Donec quis orci eget orci vehicula condimentum.
15,6,51,Duis aliquam convallis nunc. Proin at turpis a pede posuere nonummy. Integer non velit.
25,6,83,"Integer ac neque. Duis bibendum. Morbi non quam nec dui luctus rutrum. Nulla tellus. In sagittis dui vel nisl. Duis ac nibh. Fusce lacus purus, aliquet at, feugiat non, pretium quis, lectus."
13,6,66,"Morbi vel lectus in quam fringilla rhoncus. Mauris enim leo, rhoncus sed, vestibulum sit amet, cursus id, turpis."
22,3,40,"Mauris lacinia sapien quis libero. Nullam sit amet turpis elementum ligula vehicula consequat. Morbi a ipsum. Integer a nibh. In quis justo. Maecenas rhoncus aliquam lacus. Morbi quis tortor id nulla ultrices aliquet. Maecenas leo odio, condimentum id, luctus nec, molestie sed, justo."
20,9,15,In eleifend quam a odio.
4,10,44,Donec posuere metus vitae ipsum.
12,5,88,"Integer aliquet, massa id lobortis convallis, tortor risus dapibus augue, vel accumsan tellus nisi eu orci. Mauris lacinia sapien quis libero. Nullam sit amet turpis elementum ligula vehicula consequat. Morbi a ipsum. Integer a nibh. In quis justo. Maecenas rhoncus aliquam lacus."
46,9,34,"Duis bibendum. Morbi non quam nec dui luctus rutrum. Nulla tellus. In sagittis dui vel nisl. Duis ac nibh. Fusce lacus purus, aliquet at, feugiat non, pretium quis, lectus."
49,6,4,Integer a nibh. In quis justo.
33,4,63,"Nam nulla. Integer pede justo, lacinia eget, tincidunt eget, tempus vel, pede. Morbi porttitor lorem id ligula. Suspendisse ornare consequat lectus. In est risus, auctor sed, tristique in, tempus sit amet, sem. Fusce consequat. Nulla nisl. Nunc nisl."
17,7,16,Vestibulum rutrum rutrum neque. Aenean auctor gravida sem. Praesent id massa id nisl venenatis lacinia.
35,7,89,"Morbi odio odio, elementum eu, interdum eu, tincidunt in, leo. Maecenas pulvinar lobortis est. Phasellus sit amet erat. Nulla tempus."
41,9,98,"Integer pede justo, lacinia eget, tincidunt eget, tempus vel, pede. Morbi porttitor lorem id ligula. Suspendisse ornare consequat lectus. In est risus, auctor sed, tristique in, tempus sit amet, sem."
42,3,4,Nulla facilisi. Cras non velit nec nisi vulputate nonummy.
5,8,93,"Nulla justo. Aliquam quis turpis eget elit sodales scelerisque. Mauris sit amet eros. Suspendisse accumsan tortor quis turpis. Sed ante. Vivamus tortor. Duis mattis egestas metus. Aenean fermentum. Donec ut mauris eget massa tempor convallis. Nulla neque libero, convallis eget, eleifend luctus, ultricies eu, nibh."
11,7,90,"Proin interdum mauris non ligula pellentesque ultrices. Phasellus id sapien in sapien iaculis congue. Vivamus metus arcu, adipiscing molestie, hendrerit at, vulputate vitae, nisl. Aenean lectus. Pellentesque eget nunc. Donec quis orci eget orci vehicula condimentum. Curabitur in libero ut massa volutpat convallis. Morbi odio odio, elementum eu, interdum eu, tincidunt in, leo. Maecenas pulvinar lobortis est. Phasellus sit amet erat."
34,9,72,"Morbi non lectus. Aliquam sit amet diam in magna bibendum imperdiet. Nullam orci pede, venenatis non, sodales sed, tincidunt eu, felis. Fusce posuere felis sed lacus. Morbi sem mauris, laoreet ut, rhoncus aliquet, pulvinar sed, nisl. Nunc rhoncus dui vel sem. Sed sagittis. Nam congue, risus semper porta volutpat, quam pede lobortis ligula, sit amet eleifend pede libero quis orci. Nullam molestie nibh in lectus. Pellentesque at nulla."
14,8,17,Nullam molestie nibh in lectus. Pellentesque at nulla. Suspendisse potenti.
35,3,5,Duis aliquam convallis nunc. Proin at turpis a pede posuere nonummy.
44,10,6,"Cras mi pede, malesuada in, imperdiet et, commodo vulputate, justo. In blandit ultrices enim. Lorem ipsum dolor sit amet, consectetuer adipiscing elit."
3,4,5,"Morbi quis tortor id nulla ultrices aliquet. Maecenas leo odio, condimentum id, luctus nec, molestie sed, justo."
30,9,45,"Nullam orci pede, venenatis non, sodales sed, tincidunt eu, felis. Fusce posuere felis sed lacus. Morbi sem mauris, laoreet ut, rhoncus aliquet, pulvinar sed, nisl. Nunc rhoncus dui vel sem. Sed sagittis. Nam congue, risus semper porta volutpat, quam pede lobortis ligula, sit amet eleifend pede libero quis orci. Nullam molestie nibh in lectus. Pellentesque at nulla. Suspendisse potenti."
10,9,61,"Cras pellentesque volutpat dui. Maecenas tristique, est et tempus semper, est quam pharetra magna, ac consequat metus sapien ut nunc. Vestibulum ante ipsum primis in faucibus orci luctus et ultrices posuere cubilia Curae; Mauris viverra diam vitae quam."
42,5,91,"Aenean fermentum. Donec ut mauris eget massa tempor convallis. Nulla neque libero, convallis eget, eleifend luctus, ultricies eu, nibh. Quisque id justo sit amet sapien dignissim vestibulum. Vestibulum ante ipsum primis in faucibus orci luctus et ultrices posuere cubilia Curae; Nulla dapibus dolor vel est. Donec odio justo, sollicitudin ut, suscipit a, feugiat et, eros. Vestibulum ac est lacinia nisi venenatis tristique. Fusce congue, diam id ornare imperdiet, sapien urna pretium nisl, ut volutpat sapien arcu sed augue. Aliquam erat volutpat."
36,7,97,"Etiam vel augue. Vestibulum rutrum rutrum neque. Aenean auctor gravida sem. Praesent id massa id nisl venenatis lacinia. Aenean sit amet justo. Morbi ut odio. Cras mi pede, malesuada in, imperdiet et, commodo vulputate, justo. In blandit ultrices enim."
3,8,31,"Integer pede justo, lacinia eget, tincidunt eget, tempus vel, pede. Morbi porttitor lorem id ligula. Suspendisse ornare consequat lectus. In est risus, auctor sed, tristique in, tempus sit amet, sem. Fusce consequat. Nulla nisl. Nunc nisl. Duis bibendum, felis sed interdum venenatis, turpis enim blandit mi, in porttitor pede justo eu massa. Donec dapibus."
49,9,12,"Donec diam neque, vestibulum eget, vulputate ut, ultrices vel, augue. Vestibulum ante ipsum primis in faucibus orci luctus et ultrices posuere cubilia Curae; Donec pharetra, magna vestibulum aliquet ultrices, erat tortor sollicitudin mi, sit amet lobortis sapien sapien non mi. Integer ac neque. Duis bibendum. Morbi non quam nec dui luctus rutrum. Nulla tellus."
22,10,56,Ut tellus. Nulla ut erat id mauris vulputate elementum. Nullam varius. Nulla facilisi.
27,10,79,Etiam pretium iaculis justo. In hac habitasse platea dictumst. Etiam faucibus cursus urna. Ut tellus. Nulla ut erat id mauris vulputate elementum. Nullam varius. Nulla facilisi.
28,9,35,"In tempor, turpis nec euismod scelerisque, quam turpis adipiscing lorem, vitae mattis nibh ligula nec sem. Duis aliquam convallis nunc. Proin at turpis a pede posuere nonummy. Integer non velit. Donec diam neque, vestibulum eget, vulputate ut, ultrices vel, augue."
36,8,23,"Integer non velit. Donec diam neque, vestibulum eget, vulputate ut, ultrices vel, augue. Vestibulum ante ipsum primis in faucibus orci luctus et ultrices posuere cubilia Curae; Donec pharetra, magna vestibulum aliquet ultrices, erat tortor sollicitudin mi, sit amet lobortis sapien sapien non mi. Integer ac neque. Duis bibendum. Morbi non quam nec dui luctus rutrum. Nulla tellus. In sagittis dui vel nisl. Duis ac nibh. Fusce lacus purus, aliquet at, feugiat non, pretium quis, lectus."
47,9,21,"Vestibulum quam sapien, varius ut, blandit non, interdum in, ante. Vestibulum ante ipsum primis in faucibus orci luctus et ultrices posuere cubilia Curae; Duis faucibus accumsan odio. Curabitur convallis. Duis consequat dui nec nisi volutpat eleifend. Donec ut dolor. Morbi vel lectus in quam fringilla rhoncus. Mauris enim leo, rhoncus sed, vestibulum sit amet, cursus id, turpis."
22,10,11,"Cras mi pede, malesuada in, imperdiet et, commodo vulputate, justo. In blandit ultrices enim. Lorem ipsum dolor sit amet, consectetuer adipiscing elit. Proin interdum mauris non ligula pellentesque ultrices. Phasellus id sapien in sapien iaculis congue. Vivamus metus arcu, adipiscing molestie, hendrerit at, vulputate vitae, nisl. Aenean lectus. Pellentesque eget nunc. Donec quis orci eget orci vehicula condimentum."
4,4,65,"Vestibulum quam sapien, varius ut, blandit non, interdum in, ante. Vestibulum ante ipsum primis in faucibus orci luctus et ultrices posuere cubilia Curae; Duis faucibus accumsan odio. Curabitur convallis."
13,4,91,"Pellentesque viverra pede ac diam. Cras pellentesque volutpat dui. Maecenas tristique, est et tempus semper, est quam pharetra magna, ac consequat metus sapien ut nunc. Vestibulum ante ipsum primis in faucibus orci luctus et ultrices posuere cubilia Curae; Mauris viverra diam vitae quam. Suspendisse potenti."
25,9,52,"Maecenas leo odio, condimentum id, luctus nec, molestie sed, justo."
19,9,2,"Pellentesque eget nunc. Donec quis orci eget orci vehicula condimentum. Curabitur in libero ut massa volutpat convallis. Morbi odio odio, elementum eu, interdum eu, tincidunt in, leo. Maecenas pulvinar lobortis est. Phasellus sit amet erat."
36,8,58,Vestibulum ante ipsum primis in faucibus orci luctus et ultrices posuere cubilia Curae; Duis faucibus accumsan odio. Curabitur convallis. Duis consequat dui nec nisi volutpat eleifend.
41,5,59,"Sed ante. Vivamus tortor. Duis mattis egestas metus. Aenean fermentum. Donec ut mauris eget massa tempor convallis. Nulla neque libero, convallis eget, eleifend luctus, ultricies eu, nibh. Quisque id justo sit amet sapien dignissim vestibulum."
38,9,78,"Cras pellentesque volutpat dui. Maecenas tristique, est et tempus semper, est quam pharetra magna, ac consequat metus sapien ut nunc. Vestibulum ante ipsum primis in faucibus orci luctus et ultrices posuere cubilia Curae; Mauris viverra diam vitae quam. Suspendisse potenti. Nullam porttitor lacus at turpis."
51,6,95,"In est risus, auctor sed, tristique in, tempus sit amet, sem. Fusce consequat."
29,8,7,Mauris sit amet eros. Suspendisse accumsan tortor quis turpis. Sed ante.
5,5,63,"Praesent lectus. Vestibulum quam sapien, varius ut, blandit non, interdum in, ante. Vestibulum ante ipsum primis in faucibus orci luctus et ultrices posuere cubilia Curae; Duis faucibus accumsan odio. Curabitur convallis. Duis consequat dui nec nisi volutpat eleifend. Donec ut dolor. Morbi vel lectus in quam fringilla rhoncus."
31,5,5,"Nulla suscipit ligula in lacus. Curabitur at ipsum ac tellus semper interdum. Mauris ullamcorper purus sit amet nulla. Quisque arcu libero, rutrum ac, lobortis vel, dapibus at, diam."
1,7,12,"Praesent blandit lacinia erat. Vestibulum sed magna at nunc commodo placerat. Praesent blandit. Nam nulla. Integer pede justo, lacinia eget, tincidunt eget, tempus vel, pede. Morbi porttitor lorem id ligula. Suspendisse ornare consequat lectus. In est risus, auctor sed, tristique in, tempus sit amet, sem. Fusce consequat. Nulla nisl."
17,7,58,Nulla justo. Aliquam quis turpis eget elit sodales scelerisque. Mauris sit amet eros. Suspendisse accumsan tortor quis turpis. Sed ante.
26,10,4,"Aenean lectus. Pellentesque eget nunc. Donec quis orci eget orci vehicula condimentum. Curabitur in libero ut massa volutpat convallis. Morbi odio odio, elementum eu, interdum eu, tincidunt in, leo. Maecenas pulvinar lobortis est. Phasellus sit amet erat."
48,4,63,"Phasellus in felis. Donec semper sapien a libero. Nam dui. Proin leo odio, porttitor id, consequat in, consequat ut, nulla. Sed accumsan felis."
44,6,19,"Lorem ipsum dolor sit amet, consectetuer adipiscing elit. Proin risus. Praesent lectus. Vestibulum quam sapien, varius ut, blandit non, interdum in, ante. Vestibulum ante ipsum primis in faucibus orci luctus et ultrices posuere cubilia Curae; Duis faucibus accumsan odio. Curabitur convallis."
49,9,67,"Vivamus vestibulum sagittis sapien. Cum sociis natoque penatibus et magnis dis parturient montes, nascetur ridiculus mus. Etiam vel augue. Vestibulum rutrum rutrum neque. Aenean auctor gravida sem."
28,8,16,"Vestibulum ante ipsum primis in faucibus orci luctus et ultrices posuere cubilia Curae; Nulla dapibus dolor vel est. Donec odio justo, sollicitudin ut, suscipit a, feugiat et, eros."
1,8,39,Nullam porttitor lacus at turpis. Donec posuere metus vitae ipsum. Aliquam non mauris. Morbi non lectus. Aliquam sit amet diam in magna bibendum imperdiet.
30,9,56,"Suspendisse potenti. In eleifend quam a odio. In hac habitasse platea dictumst. Maecenas ut massa quis augue luctus tincidunt. Nulla mollis molestie lorem. Quisque ut erat. Curabitur gravida nisi at nibh. In hac habitasse platea dictumst. Aliquam augue quam, sollicitudin vitae, consectetuer eget, rutrum at, lorem."
20,7,96,"Sed accumsan felis. Ut at dolor quis odio consequat varius. Integer ac leo. Pellentesque ultrices mattis odio. Donec vitae nisi. Nam ultrices, libero non mattis pulvinar, nulla pede ullamcorper augue, a suscipit nulla elit ac nulla."
14,8,43,"Phasellus in felis. Donec semper sapien a libero. Nam dui. Proin leo odio, porttitor id, consequat in, consequat ut, nulla. Sed accumsan felis. Ut at dolor quis odio consequat varius. Integer ac leo. Pellentesque ultrices mattis odio. Donec vitae nisi. Nam ultrices, libero non mattis pulvinar, nulla pede ullamcorper augue, a suscipit nulla elit ac nulla."
7,8,98,Nullam sit amet turpis elementum ligula vehicula consequat. Morbi a ipsum. Integer a nibh. In quis justo.
33,7,76,"Vestibulum ante ipsum primis in faucibus orci luctus et ultrices posuere cubilia Curae; Donec pharetra, magna vestibulum aliquet ultrices, erat tortor sollicitudin mi, sit amet lobortis sapien sapien non mi. Integer ac neque. Duis bibendum. Morbi non quam nec dui luctus rutrum. Nulla tellus. In sagittis dui vel nisl."
38,4,64,"Duis mattis egestas metus. Aenean fermentum. Donec ut mauris eget massa tempor convallis. Nulla neque libero, convallis eget, eleifend luctus, ultricies eu, nibh. Quisque id justo sit amet sapien dignissim vestibulum. Vestibulum ante ipsum primis in faucibus orci luctus et ultrices posuere cubilia Curae; Nulla dapibus dolor vel est. Donec odio justo, sollicitudin ut, suscipit a, feugiat et, eros. Vestibulum ac est lacinia nisi venenatis tristique."
48,5,78,"Donec odio justo, sollicitudin ut, suscipit a, feugiat et, eros. Vestibulum ac est lacinia nisi venenatis tristique. Fusce congue, diam id ornare imperdiet, sapien urna pretium nisl, ut volutpat sapien arcu sed augue. Aliquam erat volutpat. In congue. Etiam justo. Etiam pretium iaculis justo. In hac habitasse platea dictumst."
16,6,7,Morbi non quam nec dui luctus rutrum. Nulla tellus.
16,3,100,Aenean lectus. Pellentesque eget nunc.
3,9,21,Pellentesque viverra pede ac diam. Cras pellentesque volutpat dui.
49,9,65,"Nulla suscipit ligula in lacus. Curabitur at ipsum ac tellus semper interdum. Mauris ullamcorper purus sit amet nulla. Quisque arcu libero, rutrum ac, lobortis vel, dapibus at, diam."
52,7,62,"Etiam vel augue. Vestibulum rutrum rutrum neque. Aenean auctor gravida sem. Praesent id massa id nisl venenatis lacinia. Aenean sit amet justo. Morbi ut odio. Cras mi pede, malesuada in, imperdiet et, commodo vulputate, justo. In blandit ultrices enim. Lorem ipsum dolor sit amet, consectetuer adipiscing elit."
19,5,6,"Aenean sit amet justo. Morbi ut odio. Cras mi pede, malesuada in, imperdiet et, commodo vulputate, justo. In blandit ultrices enim. Lorem ipsum dolor sit amet, consectetuer adipiscing elit. Proin interdum mauris non ligula pellentesque ultrices. Phasellus id sapien in sapien iaculis congue. Vivamus metus arcu, adipiscing molestie, hendrerit at, vulputate vitae, nisl. Aenean lectus."
48,7,36,Vestibulum ante ipsum primis in faucibus orci luctus et ultrices posuere cubilia Curae; Mauris viverra diam vitae quam. Suspendisse potenti. Nullam porttitor lacus at turpis. Donec posuere metus vitae ipsum. Aliquam non mauris. Morbi non lectus. Aliquam sit amet diam in magna bibendum imperdiet.
11,5,96,Donec dapibus. Duis at velit eu est congue elementum.
51,6,57,"Morbi non lectus. Aliquam sit amet diam in magna bibendum imperdiet. Nullam orci pede, venenatis non, sodales sed, tincidunt eu, felis. Fusce posuere felis sed lacus."
50,9,72,Phasellus in felis.
1,7,20,"Cras pellentesque volutpat dui. Maecenas tristique, est et tempus semper, est quam pharetra magna, ac consequat metus sapien ut nunc. Vestibulum ante ipsum primis in faucibus orci luctus et ultrices posuere cubilia Curae; Mauris viverra diam vitae quam."
48,9,13,"Aliquam augue quam, sollicitudin vitae, consectetuer eget, rutrum at, lorem. Integer tincidunt ante vel ipsum. Praesent blandit lacinia erat. Vestibulum sed magna at nunc commodo placerat. Praesent blandit. Nam nulla. Integer pede justo, lacinia eget, tincidunt eget, tempus vel, pede. Morbi porttitor lorem id ligula. Suspendisse ornare consequat lectus. In est risus, auctor sed, tristique in, tempus sit amet, sem."
1,6,28,Nullam varius. Nulla facilisi. Cras non velit nec nisi vulputate nonummy. Maecenas tincidunt lacus at velit. Vivamus vel nulla eget eros elementum pellentesque.
6,10,50,"Morbi non lectus. Aliquam sit amet diam in magna bibendum imperdiet. Nullam orci pede, venenatis non, sodales sed, tincidunt eu, felis. Fusce posuere felis sed lacus. Morbi sem mauris, laoreet ut, rhoncus aliquet, pulvinar sed, nisl. Nunc rhoncus dui vel sem. Sed sagittis. Nam congue, risus semper porta volutpat, quam pede lobortis ligula, sit amet eleifend pede libero quis orci. Nullam molestie nibh in lectus."
20,4,77,"Donec dapibus. Duis at velit eu est congue elementum. In hac habitasse platea dictumst. Morbi vestibulum, velit id pretium iaculis, diam erat fermentum justo, nec condimentum neque sapien placerat ante. Nulla justo. Aliquam quis turpis eget elit sodales scelerisque. Mauris sit amet eros. Suspendisse accumsan tortor quis turpis."
38,10,50,Morbi non quam nec dui luctus rutrum. Nulla tellus. In sagittis dui vel nisl. Duis ac nibh.